{
  "$schema": "https://json-schema.org/draft/2020-12/schema",
  "title": "GhostESP Native SD App Manifest v1",
  "type": "object",
  "required": ["id", "name", "version", "entry", "target", "api_version"],
  "additionalProperties": true,
  "properties": {
    "id": { "type": "string", "pattern": "^[A-Za-z0-9_-]+$" },
    "name": { "type": "string", "minLength": 1 },
    "version": { "type": "string" },
    "author": { "type": "string" },
    "description": { "type": "string" },
    "category": {
      "type": "string",
      "description": "Apps gallery folder. Must match one of the firmware's built-in folders so the app is filed alongside the built-ins; an unrecognised value leaves the app at the gallery root.",
      "enum": ["Tools", "System", "Games", "Communication", "Media", "Sensors"]
    },
    "entry": { "type": "string" },
    "target": { "type": "string" },
    "api_version": { "type": "integer", "const": 1 },
    "manifest_version": { "type": "integer", "const": 1 },
    "package_version": { "type": "integer", "minimum": 1 },
    "data_version": { "type": "integer", "minimum": 1 },
    "storage_scope": { "type": "string", "enum": ["app", "ghostesp"] },
    "permissions": {
      "type": "array",
      "items": {
        "type": "string",
        "enum": [
          "ui",
          "storage",
          "commands",
          "command",
          "tasks",
          "wifi",
          "espnow",
          "ble",
          "nfc",
          "ir",
          "infrared",
          "subghz",
          "badusb",
          "raw_gpio",
          "lvgl",
          "rgb",
          "led",
          "leds",
          "uart",
          "serial",
          "i2c",
          "spi",
          "adc",
          "pwm",
          "ledc",
          "network",
          "http",
          "wifi_control",
          "power",
          "battery",
          "input",
          "buttons",
          "display",
          "backlight",
          "time",
          "random",
          "system",
          "camera",
          "usb",
          "ethernet",
          "eth",
          "audio",
          "mic",
          "microphone",
          "settings",
          "zigbee",
          "ieee802154",
          "nrf24"
        ]
      }
    },
    "unsafe": { "type": "boolean" },
    "icon": { "type": "string" },
    "icon_width": { "type": "integer", "minimum": 1 },
    "icon_height": { "type": "integer", "minimum": 1 },
    "icon_format": { "type": "string", "enum": ["rgb565", "rgb565a8"] },
    "icon_source": { "type": "string" },
    "accent_color": { "type": "string", "pattern": "^#?[0-9A-Fa-f]{6}$" },
    "assets": {
      "type": "array",
      "items": { "type": "string" }
    },
    "memory_limit": { "type": "integer", "minimum": 0 },
    "stack_size": { "type": "integer", "minimum": 0 },
    "tick_interval_ms": { "type": "integer", "minimum": 16, "maximum": 1000 },
    "forward_back": { "type": "boolean" },
    "requires_psram": { "type": "boolean" },
    "requires_features": {
      "type": "array",
      "items": {
        "type": "string",
        "enum": ["touchscreen", "touch", "dpad", "joystick", "encoder", "keyboard", "physical_keyboard"]
      },
      "uniqueItems": true
    },
    "checksum": { "type": "string" }
  }
}
